{
  "schema_version": 1,
  "diagram_type": "architecture",
  "meta": {
    "title": "Sample Web App — Request Walkthrough",
    "output": "web-app-rendered.html",
    "quality_profile": "showcase",
    "views": [
      {
        "id": "request-path",
        "label": "Primary request path",
        "focus": [
          "users",
          "cdn",
          "lb",
          "api",
          "db"
        ],
        "note": "Follow the primary customer request from the edge to durable state."
      },
      {
        "id": "identity-and-cache",
        "label": "Identity and cache",
        "focus": [
          "auth",
          "api",
          "cache"
        ],
        "note": "Isolate authentication and the read-through cache beside the request path."
      },
      {
        "id": "async-work",
        "label": "Static and async work",
        "focus": [
          "cdn",
          "s3",
          "api",
          "queue",
          "worker"
        ],
        "note": "See the two secondary paths without adding noise to the main request."
      }
    ],
    "walkthrough": {
      "title": "One page view, edge to worker",
      "flow": "continuous",
      "steps": [
        {
          "id": "edge",
          "title": "The request lands at the edge",
          "clock": "t+0 ms",
          "body": "A browser resolves the site to CloudFront. Static assets are served straight from S3; everything else is forwarded to the load balancer.\n\nNothing inside the VPC has a public address.",
          "notes": [
            {
              "title": "Why the CDN is first",
              "body": "It absorbs the static traffic and keeps the origin's attack surface to one listener."
            }
          ],
          "focus": [
            "users",
            "cdn",
            "s3",
            "lb"
          ],
          "edges": [
            "users-to-cdn",
            "static-assets",
            "cdn-to-lb"
          ],
          "state": [
            "HTTPS only",
            "static from S3"
          ]
        },
        {
          "id": "api",
          "title": "The API checks identity, then reads through the cache",
          "clock": "t+20 ms",
          "body": "The load balancer hands the request to an API server. The server verifies the caller's JWT against the auth provider, then asks Redis first and PostgreSQL only on a miss.",
          "notes": [
            {
              "title": "Read-through, not write-around",
              "body": "A miss populates the cache on the way back, so the next identical read never reaches the database."
            }
          ],
          "focus": [
            "lb",
            "api",
            "auth",
            "cache",
            "db"
          ],
          "edges": [
            "lb-to-api",
            "jwt-verification",
            "cache-read-through",
            "api-sql"
          ],
          "dim": [
            "users",
            "cdn",
            "s3"
          ],
          "state": [
            "JWT verified",
            "cache miss → SQL"
          ]
        },
        {
          "id": "async",
          "title": "Slow work leaves through a queue",
          "clock": "t+25 ms",
          "body": "Anything that need not finish inside the request is enqueued to SQS. A worker drains it independently, so the API responds fast and the worker can retry without the user waiting.",
          "focus": [
            "api",
            "queue",
            "worker"
          ],
          "edges": [
            "enqueue-job",
            "queue-to-worker"
          ],
          "dim": [
            "users",
            "cdn",
            "s3",
            "lb",
            "auth",
            "cache"
          ],
          "state": [
            "response sent",
            "job queued"
          ]
        }
      ]
    }
  },
  "components": [
    {
      "id": "users",
      "type": "external",
      "label": "Users",
      "sublabel": "Browser / Mobile",
      "pos": [
        40,
        300
      ],
      "size": [
        120,
        60
      ]
    },
    {
      "id": "auth",
      "type": "security",
      "label": "Auth Provider",
      "sublabel": "OAuth 2.0",
      "pos": [
        40,
        110
      ],
      "size": [
        120,
        64
      ],
      "tag": "JWT + PKCE"
    },
    {
      "id": "cdn",
      "type": "cloud",
      "label": "CloudFront",
      "sublabel": "CDN",
      "pos": [
        250,
        300
      ],
      "size": [
        130,
        60
      ]
    },
    {
      "id": "lb",
      "type": "cloud",
      "label": "Load Balancer",
      "sublabel": "HTTPS :443",
      "pos": [
        460,
        300
      ],
      "size": [
        130,
        60
      ]
    },
    {
      "id": "api",
      "type": "backend",
      "label": "API Server",
      "sublabel": "FastAPI :8000",
      "pos": [
        670,
        300
      ],
      "size": [
        130,
        60
      ]
    },
    {
      "id": "cache",
      "type": "database",
      "label": "Redis",
      "sublabel": "cache :6379",
      "pos": [
        670,
        150
      ],
      "size": [
        130,
        60
      ]
    },
    {
      "id": "db",
      "type": "database",
      "label": "PostgreSQL",
      "sublabel": "primary :5432",
      "pos": [
        880,
        300
      ],
      "size": [
        130,
        60
      ]
    },
    {
      "id": "s3",
      "type": "cloud",
      "label": "S3",
      "sublabel": "static assets",
      "pos": [
        250,
        440
      ],
      "size": [
        130,
        60
      ],
      "tag": "OAI protected"
    },
    {
      "id": "queue",
      "type": "messagebus",
      "label": "SQS",
      "sublabel": "job queue",
      "pos": [
        670,
        440
      ],
      "size": [
        130,
        60
      ]
    },
    {
      "id": "worker",
      "type": "backend",
      "label": "Worker",
      "sublabel": "async jobs",
      "pos": [
        880,
        440
      ],
      "size": [
        130,
        60
      ]
    }
  ],
  "boundaries": [
    {
      "kind": "region",
      "label": "AWS Region: us-west-2",
      "wraps": [
        "cdn",
        "lb",
        "api",
        "cache",
        "db",
        "s3",
        "queue",
        "worker"
      ]
    },
    {
      "kind": "security-group",
      "label": "sg-api :443/:8000",
      "wraps": [
        "lb",
        "api"
      ]
    }
  ],
  "connections": [
    {
      "id": "users-to-cdn",
      "from": "users",
      "to": "cdn",
      "label": "HTTPS",
      "variant": "emphasis"
    },
    {
      "id": "jwt-verification",
      "from": "auth",
      "to": "api",
      "label": "verify JWT",
      "variant": "security",
      "fromSide": "right",
      "toSide": "top",
      "via": [
        [
          620,
          142
        ],
        [
          620,
          246
        ],
        [
          735,
          246
        ]
      ]
    },
    {
      "id": "cdn-to-lb",
      "from": "cdn",
      "to": "lb"
    },
    {
      "id": "static-assets",
      "from": "cdn",
      "to": "s3",
      "label": "static",
      "variant": "dashed",
      "fromSide": "bottom",
      "toSide": "top",
      "labelDy": 58
    },
    {
      "id": "lb-to-api",
      "from": "lb",
      "to": "api"
    },
    {
      "id": "cache-read-through",
      "from": "api",
      "to": "cache",
      "label": "read-through",
      "fromSide": "top",
      "toSide": "bottom",
      "labelDy": -68
    },
    {
      "id": "api-sql",
      "from": "api",
      "to": "db",
      "label": "SQL"
    },
    {
      "id": "enqueue-job",
      "from": "api",
      "to": "queue",
      "label": "enqueue",
      "variant": "dashed",
      "fromSide": "bottom",
      "toSide": "top",
      "labelDy": 58
    },
    {
      "id": "queue-to-worker",
      "from": "queue",
      "to": "worker"
    }
  ],
  "cards": [
    {
      "dot": "cyan",
      "title": "Edge",
      "items": [
        "CloudFront CDN fronts all traffic",
        "S3 serves static assets via OAI"
      ]
    },
    {
      "dot": "emerald",
      "title": "Application",
      "items": [
        "FastAPI behind an HTTPS load balancer",
        "Redis read-through cache",
        "Async work drained from SQS by a worker"
      ]
    },
    {
      "dot": "rose",
      "title": "Security",
      "items": [
        "OAuth 2.0 with JWT + PKCE",
        "API + LB isolated in a security group"
      ]
    }
  ]
}
